{
  "id": "m68k-netbsd.compiler-smoke",
  "platform": "m68k-netbsd",
  "kind": "compiler",
  "guest": {
    "artifact": "guest/artifacts/m68k-netbsd/compiler-smoke.tar",
    "command": "./run-build.sh",
    "input": "guest/inputs/compiler-smoke"
  },
  "measurement": {
    "metric": "wall-clock",
    "unit": "seconds",
    "iterations": 3
  },
  "correctness": {
    "type": "sha256",
    "expected": "TBD"
  }
}
